commit	quality_score	gate_pass	M1_palette	M2_dominant	M3_cct	M4_msssim	M5_edge	M6_texture	M7_vmaf	M8_temporal	M9_layer_indep	M10_role_cohere	model_version	elapsed_ms	status	description
none	0.5680	1	0.6412	0.6315	0.6005	0.2711	0.5709	0.6510	0.1862	0.9999	0.1645	0.9000	local-2026-03-29	205347	discard	exp #1
none	0.5684	1	0.6233	0.6800	0.5113	0.2733	0.6015	0.7201	0.1733	0.9999	0.1645	0.9000	local-2026-03-29	137956	discard	exp #2
none	0.5529	1	0.6205	0.6352	0.4306	0.2739	0.5781	0.7258	0.1828	0.9999	0.1637	0.9000	local-2026-03-29	193753	discard	exp #3
none	0.0000	0	0.3606	0.5043	0.5406	0.0891	0.2293	0.0000	0.5000	0.9999	0.1645	0.9000	local-2026-03-29	200029	discard	exp #4
none	0.5620	1	0.6296	0.6355	0.5072	0.2785	0.6070	0.6934	0.1723	0.9999	0.1645	0.9000	local-2026-03-29	219237	discard	exp #5
none	0.5649	1	0.6186	0.6720	0.5107	0.2760	0.6067	0.6845	0.1768	0.9999	0.1645	0.9000	local-2026-03-29	170237	discard	exp #6
none	0.5684	1	0.6233	0.6800	0.5113	0.2733	0.6015	0.7201	0.1733	0.9999	0.1645	0.9000	local-2026-03-29	199267	discard	exp #7
none	0.5525	1	0.6134	0.6921	0.3735	0.2850	0.5876	0.7230	0.1728	0.9999	0.1642	0.9000	local-2026-03-29	186847	discard	exp #8
none	0.5684	1	0.6233	0.6800	0.5113	0.2733	0.6015	0.7201	0.1733	0.9999	0.1645	0.9000	local-2026-03-29	198505	discard	exp #9
none	0.0000	0	0.5873	0.6929	0.2790	0.2641	0.5685	0.7382	0.1801	0.9999	0.1155	0.8667	local-2026-03-29	167533	discard	exp #10
none	0.5404	1	0.5801	0.7017	0.2618	0.2643	0.5667	0.7315	0.1798	0.9999	0.2549	0.8667	local-2026-03-29	152994	discard	exp #11
none	0.5220	1	0.5811	0.6385	0.2431	0.2482	0.5573	0.6331	0.1935	0.9999	0.2549	0.8667	local-2026-03-29	158662	discard	exp #12
6e6254d	0.5970	1	0.6119	0.6927	0.5799	0.2604	0.5933	0.8366	0.1745	0.9999	0.3216	0.8667	local-2026-03-29	204234	keep	exp #13
none	0.5851	1	0.6278	0.7035	0.5334	0.2595	0.5938	0.8439	0.1768	0.9999	0.1845	0.9000	local-2026-03-29	156492	discard	exp #14
none	0.5813	1	0.6124	0.6500	0.5072	0.2716	0.6169	0.7795	0.1738	0.9999	0.3178	0.8667	local-2026-03-29	166008	discard	exp #15
none	0.5977	1	0.6183	0.6959	0.5800	0.2609	0.5930	0.8285	0.1766	0.9999	0.3216	0.8667	local-2026-03-29	162402	discard	exp #16
none	0.5984	1	0.6240	0.6898	0.5760	0.2614	0.5960	0.8430	0.1740	0.9999	0.3216	0.8667	local-2026-03-29	198181	discard	exp #17
none	0.6021	1	0.6241	0.7181	0.5745	0.2609	0.5946	0.8537	0.1725	0.9999	0.3216	0.8667	local-2026-03-29	156351	discard	exp #18
none	0.6025	1	0.6201	0.7216	0.5717	0.2614	0.5977	0.8615	0.1705	0.9999	0.3216	0.8667	local-2026-03-29	157718	discard	exp #19
none	0.6015	1	0.6134	0.7180	0.5694	0.2612	0.5964	0.8704	0.1694	0.9999	0.3216	0.8667	local-2026-03-29	137697	discard	exp #20
none	0.6012	1	0.6194	0.7161	0.5712	0.2615	0.5944	0.8571	0.1720	0.9999	0.3216	0.8667	local-2026-03-29	138595	discard	exp #21
none	0.6014	1	0.6157	0.7193	0.5715	0.2614	0.5956	0.8600	0.1711	0.9999	0.3216	0.8667	local-2026-03-29	196358	discard	exp #22
none	0.6023	1	0.6227	0.7170	0.5730	0.2612	0.5975	0.8587	0.1718	0.9999	0.3216	0.8667	local-2026-03-29	156398	discard	exp #23
none	0.6018	1	0.6181	0.7160	0.5706	0.2612	0.5976	0.8665	0.1705	0.9999	0.3216	0.8667	local-2026-03-29	142895	discard	exp #24
none	0.6026	1	0.6189	0.7237	0.5713	0.2610	0.5959	0.8637	0.1709	0.9999	0.3216	0.8667	local-2026-03-29	136319	discard	exp #25
none	0.6025	1	0.6226	0.7194	0.5733	0.2613	0.5983	0.8572	0.1722	0.9999	0.3216	0.8667	local-2026-03-29	135855	discard	exp #26
none	0.6016	1	0.6163	0.7206	0.5699	0.2614	0.5956	0.8618	0.1709	0.9999	0.3216	0.8667	local-2026-03-29	137105	discard	exp #27
none	0.6034	1	0.6183	0.7215	0.5753	0.2642	0.5967	0.8678	0.1713	0.9999	0.3216	0.8667	local-2026-03-29	138034	discard	exp #28
none	0.6010	1	0.6152	0.7202	0.5680	0.2581	0.5997	0.8596	0.1701	0.9999	0.3216	0.8667	local-2026-03-29	136153	discard	exp #29
none	0.6022	1	0.6225	0.7190	0.5720	0.2617	0.5961	0.8597	0.1705	0.9999	0.3216	0.8667	local-2026-03-29	134486	discard	exp #30
none	0.6001	1	0.6201	0.6937	0.5724	0.2605	0.5982	0.8701	0.1715	0.9999	0.3216	0.8667	local-2026-03-29	137788	discard	exp #31
none	0.6032	1	0.6198	0.7215	0.5766	0.2640	0.5936	0.8641	0.1715	0.9999	0.3216	0.8667	local-2026-03-29	139419	discard	exp #32
none	0.6045	1	0.6236	0.7222	0.5743	0.2643	0.5964	0.8751	0.1705	0.9999	0.3216	0.8667	local-2026-03-29	138237	discard	exp #33
none	0.5996	1	0.6207	0.6873	0.5747	0.2647	0.5971	0.8657	0.1717	0.9999	0.3216	0.8667	local-2026-03-29	137444	discard	exp #34
none	0.6022	1	0.6252	0.7057	0.5756	0.2641	0.5946	0.8663	0.1717	0.9999	0.3216	0.8667	local-2026-03-29	135609	discard	exp #35
none	0.6031	1	0.6147	0.7229	0.5768	0.2642	0.5978	0.8619	0.1724	0.9999	0.3216	0.8667	local-2026-03-29	136543	discard	exp #36
none	0.6025	1	0.6201	0.7216	0.5717	0.2614	0.5977	0.8615	0.1705	0.9999	0.3216	0.8667	local-2026-03-29	135559	discard	exp #37
none	0.6025	1	0.6201	0.7216	0.5717	0.2614	0.5977	0.8615	0.1705	0.9999	0.3216	0.8667	local-2026-03-29	135289	discard	exp #38
none	0.6025	1	0.6201	0.7216	0.5717	0.2614	0.5977	0.8615	0.1705	0.9999	0.3216	0.8667	local-2026-03-29	136542	discard	exp #39
none	0.6016	1	0.6217	0.6944	0.5769	0.2642	0.5967	0.8761	0.1715	0.9999	0.3216	0.8667	local-2026-03-29	137377	discard	exp #40
none	0.6003	1	0.6165	0.7168	0.5660	0.2563	0.5987	0.8593	0.1701	0.9999	0.3216	0.8667	local-2026-03-29	136166	discard	exp #41
none	0.6040	1	0.6191	0.7181	0.5726	0.2640	0.5981	0.8839	0.1689	0.9999	0.3216	0.8667	local-2026-03-29	137062	discard	exp #42
none	0.6020	1	0.6218	0.7165	0.5685	0.2604	0.5986	0.8650	0.1703	0.9999	0.3216	0.8667	local-2026-03-29	135293	discard	exp #43
none	0.6003	1	0.6109	0.7154	0.5671	0.2584	0.5979	0.8677	0.1690	0.9999	0.3216	0.8667	local-2026-03-29	137353	discard	exp #44
none	0.6004	1	0.6131	0.7170	0.5716	0.2614	0.5963	0.8528	0.1716	0.9999	0.3216	0.8667	local-2026-03-29	137102	discard	exp #45
none	0.5994	1	0.6141	0.6952	0.5685	0.2581	0.5997	0.8772	0.1690	0.9999	0.3216	0.8667	local-2026-03-29	137817	discard	exp #46
none	0.6005	1	0.6183	0.7147	0.5632	0.2566	0.5992	0.8689	0.1677	0.9999	0.3216	0.8667	local-2026-03-29	135199	discard	exp #47
none	0.6009	1	0.6173	0.7211	0.5682	0.2572	0.5969	0.8567	0.1706	0.9999	0.3216	0.8667	local-2026-03-29	138371	discard	exp #48
none	0.6043	1	0.6218	0.7184	0.5727	0.2619	0.5986	0.8835	0.1699	0.9999	0.3216	0.8667	local-2026-03-29	138051	discard	exp #49
none	0.6011	1	0.6167	0.7070	0.5712	0.2594	0.5998	0.8719	0.1698	0.9999	0.3216	0.8667	local-2026-03-29	137220	discard	exp #50
none	0.6026	1	0.6149	0.7209	0.5745	0.2638	0.5970	0.8647	0.1714	0.9999	0.3216	0.8667	local-2026-03-29	137169	discard	exp #51
none	0.6003	1	0.6173	0.7038	0.5700	0.2608	0.5973	0.8677	0.1702	0.9999	0.3216	0.8667	local-2026-03-29	136767	discard	exp #52
none	0.5983	1	0.6133	0.6951	0.5673	0.2606	0.5968	0.8684	0.1683	0.9999	0.3216	0.8667	local-2026-03-29	137284	discard	exp #53
none	0.6063	1	0.6198	0.7372	0.5759	0.2658	0.5970	0.8769	0.1697	0.9999	0.3216	0.8667	local-2026-03-29	138358	discard	exp #54
none	0.6017	1	0.6183	0.7168	0.5712	0.2598	0.5970	0.8650	0.1704	0.9999	0.3216	0.8667	local-2026-03-29	141619	discard	exp #55
none	0.6024	1	0.6173	0.7166	0.5767	0.2648	0.5959	0.8620	0.1714	0.9999	0.3216	0.8667	local-2026-03-29	135442	discard	exp #56
none	0.6053	1	0.6226	0.7167	0.5762	0.2649	0.5975	0.8897	0.1700	0.9999	0.3216	0.8667	local-2026-03-29	136217	discard	exp #57
none	0.6032	1	0.6208	0.7176	0.5740	0.2621	0.5996	0.8681	0.1718	0.9999	0.3216	0.8667	local-2026-03-29	141415	discard	exp #58
none	0.6018	1	0.6165	0.7200	0.5731	0.2628	0.5977	0.8552	0.1721	0.9999	0.3216	0.8667	local-2026-03-29	138108	discard	exp #59
none	0.6008	1	0.6136	0.7063	0.5746	0.2636	0.5969	0.8652	0.1710	0.9999	0.3216	0.8667	local-2026-03-29	135488	discard	exp #60
none	0.6005	1	0.6186	0.7002	0.5717	0.2600	0.5982	0.8709	0.1700	0.9999	0.3216	0.8667	local-2026-03-29	143588	discard	exp #61
none	0.6012	1	0.6198	0.7127	0.5655	0.2576	0.6005	0.8708	0.1687	0.9999	0.3216	0.8667	local-2026-03-29	135560	discard	exp #62
none	0.6033	1	0.6236	0.7120	0.5779	0.2632	0.5976	0.8660	0.1735	0.9999	0.3216	0.8667	local-2026-03-29	135525	discard	exp #63
none	0.5984	1	0.6214	0.6897	0.5652	0.2558	0.5990	0.8711	0.1686	0.9999	0.3216	0.8667	local-2026-03-29	135400	discard	exp #64
none	0.6049	1	0.6267	0.7197	0.5799	0.2642	0.5953	0.8693	0.1729	0.9999	0.3216	0.8667	local-2026-03-29	135483	discard	exp #65
none	0.6008	1	0.6226	0.6938	0.5739	0.2649	0.5956	0.8718	0.1708	0.9999	0.3216	0.8667	local-2026-03-29	135500	discard	exp #66
none	0.6011	1	0.6183	0.7248	0.5701	0.2581	0.5965	0.8490	0.1714	0.9999	0.3216	0.8667	local-2026-03-29	141213	discard	exp #67
none	0.5991	1	0.6124	0.7139	0.5648	0.2574	0.6012	0.8539	0.1698	0.9999	0.3216	0.8667	local-2026-03-29	141704	discard	exp #68
none	0.6004	1	0.6112	0.7123	0.5681	0.2591	0.5985	0.8709	0.1692	0.9999	0.3216	0.8667	local-2026-03-29	137242	discard	exp #69
none	0.6026	1	0.6143	0.7213	0.5759	0.2629	0.5957	0.8654	0.1713	0.9999	0.3216	0.8667	local-2026-03-29	136761	discard	exp #70
none	0.6038	1	0.6250	0.7203	0.5764	0.2626	0.5974	0.8618	0.1730	0.9999	0.3216	0.8667	local-2026-03-29	135348	discard	exp #71
none	0.6000	1	0.6191	0.7151	0.5658	0.2568	0.6004	0.8538	0.1698	0.9999	0.3216	0.8667	local-2026-03-29	134931	discard	exp #72
none	0.6019	1	0.6185	0.7024	0.5745	0.2652	0.5983	0.8762	0.1700	0.9999	0.3216	0.8667	local-2026-03-29	139022	discard	exp #73
none	0.6043	1	0.6187	0.7323	0.5742	0.2617	0.5974	0.8643	0.1722	0.9999	0.3216	0.8667	local-2026-03-29	135887	discard	exp #74
none	0.6028	1	0.6134	0.7166	0.5764	0.2660	0.5961	0.8723	0.1707	0.9999	0.3216	0.8667	local-2026-03-29	136484	discard	exp #75
none	0.6009	1	0.6121	0.7209	0.5697	0.2597	0.5955	0.8609	0.1705	0.9999	0.3216	0.8667	local-2026-03-29	138345	discard	exp #76
none	0.6033	1	0.6244	0.7199	0.5759	0.2640	0.5943	0.8607	0.1721	0.9999	0.3216	0.8667	local-2026-03-29	134257	discard	exp #77
none	0.6013	1	0.6091	0.7210	0.5757	0.2642	0.5942	0.8576	0.1719	0.9999	0.3216	0.8667	local-2026-03-29	138146	discard	exp #78
none	0.6006	1	0.6128	0.6943	0.5763	0.2642	0.5974	0.8783	0.1705	0.9999	0.3216	0.8667	local-2026-03-29	136075	discard	exp #79
none	0.6012	1	0.6119	0.7265	0.5706	0.2585	0.5990	0.8529	0.1713	0.9999	0.3216	0.8667	local-2026-03-29	138261	discard	exp #80
none	0.6005	1	0.6176	0.7196	0.5656	0.2572	0.5978	0.8581	0.1695	0.9999	0.3216	0.8667	local-2026-03-29	139159	discard	exp #81
none	0.6034	1	0.6134	0.7219	0.5740	0.2636	0.5968	0.8764	0.1710	0.9999	0.3216	0.8667	local-2026-03-29	135288	discard	exp #82
none	0.5988	1	0.6163	0.7094	0.5694	0.2580	0.5970	0.8467	0.1713	0.9999	0.3216	0.8667	local-2026-03-29	136917	discard	exp #83
none	0.6015	1	0.6253	0.6929	0.5769	0.2642	0.5971	0.8711	0.1720	0.9999	0.3216	0.8667	local-2026-03-29	135586	discard	exp #84
none	0.5972	1	0.6113	0.6928	0.5664	0.2568	0.5971	0.8650	0.1689	0.9999	0.3216	0.8667	local-2026-03-29	137273	discard	exp #85
none	0.6040	1	0.6274	0.7209	0.5701	0.2624	0.5987	0.8712	0.1700	0.9999	0.3216	0.8667	local-2026-03-29	139243	discard	exp #86
none	0.6018	1	0.6157	0.7196	0.5704	0.2568	0.6001	0.8669	0.1705	0.9999	0.3216	0.8667	local-2026-03-29	138149	discard	exp #87
none	0.6058	1	0.6249	0.7373	0.5749	0.2633	0.5958	0.8680	0.1709	0.9999	0.3216	0.8667	local-2026-03-29	136043	discard	exp #88
none	0.6022	1	0.6207	0.7181	0.5674	0.2600	0.5991	0.8696	0.1693	0.9999	0.3216	0.8667	local-2026-03-29	137337	discard	exp #89
none	0.6006	1	0.6233	0.6908	0.5724	0.2629	0.5977	0.8756	0.1700	0.9999	0.3216	0.8667	local-2026-03-29	136218	discard	exp #90
none	0.6021	1	0.6149	0.7312	0.5679	0.2583	0.5999	0.8577	0.1701	0.9999	0.3216	0.8667	local-2026-03-29	143147	discard	exp #91
none	0.5978	1	0.6130	0.6876	0.5698	0.2598	0.5998	0.8654	0.1702	0.9999	0.3216	0.8667	local-2026-03-29	135441	discard	exp #92
none	0.5968	1	0.6186	0.6887	0.5693	0.2574	0.5984	0.8477	0.1714	0.9999	0.3216	0.8667	local-2026-03-29	135328	discard	exp #93
none	0.6018	1	0.6113	0.7185	0.5730	0.2636	0.5966	0.8668	0.1707	0.9999	0.3216	0.8667	local-2026-03-29	135662	discard	exp #94
none	0.5986	1	0.6192	0.6954	0.5685	0.2597	0.5967	0.8615	0.1698	0.9999	0.3216	0.8667	local-2026-03-29	137644	discard	exp #95
none	0.6042	1	0.6210	0.7232	0.5742	0.2636	0.5970	0.8742	0.1701	0.9999	0.3216	0.8667	local-2026-03-29	140908	discard	exp #96
none	0.6040	1	0.6206	0.7202	0.5761	0.2647	0.5981	0.8698	0.1720	0.9999	0.3216	0.8667	local-2026-03-29	135284	discard	exp #97
none	0.6030	1	0.6162	0.7201	0.5759	0.2643	0.5959	0.8676	0.1716	0.9999	0.3216	0.8667	local-2026-03-29	136308	discard	exp #98
none	0.6012	1	0.6217	0.7131	0.5708	0.2599	0.5967	0.8589	0.1713	0.9999	0.3216	0.8667	local-2026-03-29	135523	discard	exp #99
none	0.6030	1	0.6142	0.7179	0.5793	0.2639	0.5970	0.8650	0.1734	0.9999	0.3216	0.8667	local-2026-03-29	135936	discard	exp #100
none	0.6016	1	0.6164	0.7145	0.5718	0.2627	0.5966	0.8644	0.1713	0.9999	0.3216	0.8667	local-2026-03-29	137907	discard	exp #101
none	0.6027	1	0.6204	0.7113	0.5749	0.2624	0.5981	0.8722	0.1712	0.9999	0.3216	0.8667	local-2026-03-29	137794	discard	exp #102
none	0.6001	1	0.6191	0.6959	0.5762	0.2623	0.5955	0.8644	0.1713	0.9999	0.3216	0.8667	local-2026-03-29	137062	discard	exp #103
none	0.5998	1	0.6155	0.7178	0.5636	0.2578	0.5981	0.8564	0.1701	0.9999	0.3216	0.8667	local-2026-03-29	136123	discard	exp #104
none	0.6033	1	0.6237	0.7151	0.5790	0.2663	0.5962	0.8591	0.1729	0.9999	0.3216	0.8667	local-2026-03-29	139464	discard	exp #105
none	0.5999	1	0.6164	0.6896	0.5706	0.2605	0.5990	0.8837	0.1694	0.9999	0.3216	0.8667	local-2026-03-29	136581	discard	exp #106
none	0.6017	1	0.6184	0.7164	0.5744	0.2625	0.5955	0.8579	0.1717	0.9999	0.3216	0.8667	local-2026-03-29	139028	discard	exp #107
none	0.5987	1	0.6148	0.6921	0.5718	0.2601	0.5975	0.8662	0.1709	0.9999	0.3216	0.8667	local-2026-03-29	135473	discard	exp #108
none	0.5986	1	0.6094	0.7129	0.5641	0.2583	0.5979	0.8569	0.1701	0.9999	0.3216	0.8667	local-2026-03-29	134969	discard	exp #109
none	0.6016	1	0.6212	0.7206	0.5691	0.2595	0.5961	0.8581	0.1709	0.9999	0.3216	0.8667	local-2026-03-29	135138	discard	exp #110
none	0.6012	1	0.6192	0.7134	0.5700	0.2604	0.5958	0.8657	0.1698	0.9999	0.3216	0.8667	local-2026-03-29	137488	discard	exp #111
none	0.6017	1	0.6151	0.7201	0.5728	0.2620	0.5963	0.8601	0.1712	0.9999	0.3216	0.8667	local-2026-03-29	135636	discard	exp #112
none	0.5997	1	0.6159	0.7154	0.5684	0.2592	0.5973	0.8495	0.1714	0.9999	0.3216	0.8667	local-2026-03-29	134659	discard	exp #113
none	0.6011	1	0.6156	0.7165	0.5727	0.2611	0.5966	0.8566	0.1720	0.9999	0.3216	0.8667	local-2026-03-29	138174	discard	exp #114
none	0.5993	1	0.6181	0.7145	0.5698	0.2583	0.5969	0.8409	0.1723	0.9999	0.3216	0.8667	local-2026-03-29	136096	discard	exp #115
none	0.5991	1	0.6166	0.7010	0.5722	0.2594	0.5969	0.8565	0.1714	0.9999	0.3216	0.8667	local-2026-03-29	141779	discard	exp #116
none	0.6023	1	0.6161	0.7177	0.5748	0.2612	0.5980	0.8650	0.1719	0.9999	0.3216	0.8667	local-2026-03-29	137072	discard	exp #117
none	0.6007	1	0.6245	0.7176	0.5704	0.2590	0.5967	0.8422	0.1729	0.9999	0.3216	0.8667	local-2026-03-29	134744	discard	exp #118
none	0.6002	1	0.6137	0.7192	0.5707	0.2608	0.5938	0.8518	0.1716	0.9999	0.3216	0.8667	local-2026-03-29	137064	discard	exp #119
none	0.6028	1	0.6198	0.7180	0.5743	0.2638	0.5953	0.8662	0.1715	0.9999	0.3216	0.8667	local-2026-03-29	137612	discard	exp #120
none	0.6005	1	0.6150	0.7208	0.5682	0.2570	0.5980	0.8548	0.1708	0.9999	0.3216	0.8667	local-2026-03-29	136202	discard	exp #121
none	0.6011	1	0.6121	0.7201	0.5708	0.2601	0.5998	0.8580	0.1712	0.9999	0.3216	0.8667	local-2026-03-29	135562	discard	exp #122
none	0.6005	1	0.6128	0.7086	0.5685	0.2600	0.5982	0.8733	0.1690	0.9999	0.3216	0.8667	local-2026-03-29	138301	discard	exp #123
none	0.5983	1	0.6195	0.6909	0.5665	0.2580	0.5968	0.8687	0.1690	0.9999	0.3216	0.8667	local-2026-03-29	136744	discard	exp #124
none	0.6002	1	0.6165	0.7153	0.5649	0.2571	0.6009	0.8592	0.1703	0.9999	0.3216	0.8667	local-2026-03-29	134928	discard	exp #125
none	0.6014	1	0.6184	0.6952	0.5718	0.2619	0.5990	0.8879	0.1688	0.9999	0.3216	0.8667	local-2026-03-29	140221	discard	exp #126
none	0.6001	1	0.6155	0.7027	0.5741	0.2590	0.5980	0.8644	0.1712	0.9999	0.3216	0.8667	local-2026-03-29	135862	discard	exp #127
none	0.6016	1	0.6178	0.7161	0.5737	0.2628	0.5975	0.8552	0.1723	0.9999	0.3216	0.8667	local-2026-03-29	135271	discard	exp #128
none	0.5983	1	0.6111	0.6916	0.5682	0.2612	0.5987	0.8718	0.1687	0.9999	0.3216	0.8667	local-2026-03-29	135577	discard	exp #129
none	0.6014	1	0.6215	0.7166	0.5695	0.2579	0.5982	0.8587	0.1715	0.9999	0.3216	0.8667	local-2026-03-29	138429	discard	exp #130
none	0.6032	1	0.6229	0.7066	0.5765	0.2638	0.5975	0.8776	0.1716	0.9999	0.3216	0.8667	local-2026-03-29	136519	discard	exp #131
none	0.6036	1	0.6147	0.7272	0.5762	0.2659	0.5950	0.8657	0.1717	0.9999	0.3216	0.8667	local-2026-03-29	137088	discard	exp #132
none	0.6045	1	0.6206	0.7221	0.5794	0.2627	0.5973	0.8709	0.1724	0.9999	0.3216	0.8667	local-2026-03-29	137687	discard	exp #133
none	0.5999	1	0.6124	0.7212	0.5632	0.2573	0.5964	0.8611	0.1686	0.9999	0.3216	0.8667	local-2026-03-29	135340	discard	exp #134
none	0.6027	1	0.6211	0.7124	0.5751	0.2625	0.5972	0.8704	0.1708	0.9999	0.3216	0.8667	local-2026-03-29	136541	discard	exp #135
none	0.6012	1	0.6275	0.7135	0.5711	0.2603	0.5970	0.8484	0.1721	0.9999	0.3216	0.8667	local-2026-03-29	134773	discard	exp #136
none	0.6009	1	0.6210	0.7016	0.5690	0.2584	0.6004	0.8735	0.1703	0.9999	0.3216	0.8667	local-2026-03-29	137902	discard	exp #137
none	0.6034	1	0.6166	0.7228	0.5739	0.2649	0.5964	0.8704	0.1707	0.9999	0.3216	0.8667	local-2026-03-29	135284	discard	exp #138
none	0.6043	1	0.6246	0.7162	0.5763	0.2630	0.5971	0.8758	0.1712	0.9999	0.3216	0.8667	local-2026-03-29	136449	discard	exp #139
none	0.6012	1	0.6163	0.7189	0.5681	0.2562	0.5995	0.8639	0.1700	0.9999	0.3216	0.8667	local-2026-03-29	139154	discard	exp #140
none	0.6023	1	0.6203	0.7167	0.5693	0.2620	0.5974	0.8700	0.1701	0.9999	0.3216	0.8667	local-2026-03-29	138799	discard	exp #141
none	0.6003	1	0.6196	0.6929	0.5742	0.2614	0.5998	0.8699	0.1708	0.9999	0.3216	0.8667	local-2026-03-29	135931	discard	exp #142
none	0.6014	1	0.6103	0.7173	0.5752	0.2636	0.5967	0.8609	0.1722	0.9999	0.3216	0.8667	local-2026-03-29	134905	discard	exp #143
none	0.6050	1	0.6179	0.7214	0.5784	0.2645	0.5974	0.8817	0.1717	0.9999	0.3216	0.8667	local-2026-03-29	136723	discard	exp #144
none	0.6005	1	0.6141	0.7061	0.5754	0.2637	0.5943	0.8627	0.1719	0.9999	0.3216	0.8667	local-2026-03-29	136325	discard	exp #145
none	0.6020	1	0.6174	0.6973	0.5771	0.2636	0.5978	0.8846	0.1702	0.9999	0.3216	0.8667	local-2026-03-29	135228	discard	exp #146
none	0.6012	1	0.6214	0.6912	0.5744	0.2628	0.5990	0.8804	0.1702	0.9999	0.3216	0.8667	local-2026-03-29	142186	discard	exp #147
none	0.6004	1	0.6176	0.7176	0.5716	0.2600	0.5947	0.8481	0.1719	0.9999	0.3216	0.8667	local-2026-03-29	137476	discard	exp #148
none	0.5983	1	0.6181	0.6786	0.5753	0.2614	0.5952	0.8712	0.1708	0.9999	0.3216	0.8667	local-2026-03-29	136402	discard	exp #149
none	0.6001	1	0.6092	0.7176	0.5644	0.2567	0.5985	0.8710	0.1683	0.9999	0.3216	0.8667	local-2026-03-29	136927	discard	exp #150
none	0.6052	1	0.6228	0.7202	0.5784	0.2639	0.5974	0.8797	0.1714	0.9999	0.3216	0.8667	local-2026-03-29	137469	discard	exp #151
none	0.6016	1	0.6143	0.7187	0.5762	0.2635	0.5920	0.8584	0.1726	0.9999	0.3216	0.8667	local-2026-03-29	137749	discard	exp #152
none	0.6019	1	0.6108	0.7191	0.5751	0.2648	0.5970	0.8634	0.1709	0.9999	0.3216	0.8667	local-2026-03-29	139786	discard	exp #153
none	0.6003	1	0.6123	0.7153	0.5666	0.2583	0.5977	0.8671	0.1691	0.9999	0.3216	0.8667	local-2026-03-29	136167	discard	exp #154
none	0.6017	1	0.6148	0.7222	0.5724	0.2609	0.5960	0.8578	0.1719	0.9999	0.3216	0.8667	local-2026-03-29	135549	discard	exp #155
none	0.6000	1	0.6169	0.7144	0.5676	0.2586	0.6001	0.8520	0.1706	0.9999	0.3216	0.8667	local-2026-03-29	137540	discard	exp #156
none	0.6055	1	0.6283	0.7193	0.5807	0.2642	0.5977	0.8706	0.1730	0.9999	0.3216	0.8667	local-2026-03-29	137021	discard	exp #157
none	0.6006	1	0.6208	0.7194	0.5701	0.2592	0.5952	0.8472	0.1715	0.9999	0.3216	0.8667	local-2026-03-29	136944	discard	exp #158
none	0.6012	1	0.6098	0.7170	0.5712	0.2616	0.5968	0.8701	0.1697	0.9999	0.3216	0.8667	local-2026-03-29	137196	discard	exp #159
none	0.6015	1	0.6139	0.7212	0.5680	0.2567	0.5988	0.8685	0.1698	0.9999	0.3216	0.8667	local-2026-03-29	138692	discard	exp #160
none	0.6043	1	0.6207	0.7209	0.5762	0.2625	0.5971	0.8768	0.1706	0.9999	0.3216	0.8667	local-2026-03-29	140511	discard	exp #161
none	0.5985	1	0.6166	0.7017	0.5665	0.2568	0.5980	0.8587	0.1697	0.9999	0.3216	0.8667	local-2026-03-29	136053	discard	exp #162
none	0.5944	1	0.6085	0.6793	0.5640	0.2577	0.5985	0.8559	0.1689	0.9999	0.3216	0.8667	local-2026-03-29	135826	discard	exp #163
none	0.5991	1	0.6111	0.7159	0.5677	0.2569	0.5987	0.8497	0.1711	0.9999	0.3216	0.8667	local-2026-03-29	138314	discard	exp #164
none	0.5982	1	0.6152	0.6925	0.5700	0.2586	0.6006	0.8604	0.1699	0.9999	0.3216	0.8667	local-2026-03-29	136636	discard	exp #165
none	0.6011	1	0.6215	0.7149	0.5699	0.2600	0.5974	0.8553	0.1715	0.9999	0.3216	0.8667	local-2026-03-29	137363	discard	exp #166
none	0.6033	1	0.6215	0.7206	0.5745	0.2611	0.5982	0.8648	0.1720	0.9999	0.3216	0.8667	local-2026-03-29	134715	discard	exp #167
none	0.5987	1	0.6097	0.7146	0.5630	0.2573	0.5991	0.8568	0.1692	0.9999	0.3216	0.8667	local-2026-03-29	138108	discard	exp #168
none	0.6039	1	0.6207	0.7185	0.5769	0.2648	0.5957	0.8742	0.1703	0.9999	0.3216	0.8667	local-2026-03-29	136472	discard	exp #169
none	0.6009	1	0.6144	0.7164	0.5676	0.2605	0.5955	0.8685	0.1690	0.9999	0.3216	0.8667	local-2026-03-29	137332	discard	exp #170
none	0.6016	1	0.6167	0.7077	0.5761	0.2633	0.5969	0.8671	0.1718	0.9999	0.3216	0.8667	local-2026-03-29	139411	discard	exp #171
none	0.6035	1	0.6204	0.7178	0.5725	0.2641	0.5982	0.8749	0.1697	0.9999	0.3216	0.8667	local-2026-03-29	135495	discard	exp #172
none	0.6001	1	0.6209	0.7063	0.5674	0.2560	0.5992	0.8628	0.1706	0.9999	0.3216	0.8667	local-2026-03-29	137795	discard	exp #173
